feedbackKey,userKey,userId,learningMaterialKey,title,department,feedback,rating
1,22.0,6706701a98ac07710c36af12,274,Apud dens absens.,Data Engineering,Pauper audeo cernuus.,3
2,,,230,Tergeo tamdiu utpote tepesco tandem sint solitudo esse amissio.,Data Engineering,Iste accommodo commemoro maxime confugo villa deficio.,4
3,110.0,6706701a98ac07710c36af89,21,Patruus cognatus compello vita temporibus surculus decor ventito.,Data Engineering,Copiose curia subvenio suus bibo coma titulus coaegresco.,4
4,185.0,6706701a98ac07710c36af39,97,Torrens triduana arcesso cupiditas demoror depereo veritas civitas.,Full Stack,Accusamus amplitudo thermae contabesco amissio pel demens.,1
5,136.0,6706701a98ac07710c36af79,217,Comedo alo abscido.,Data Engineering,Ulciscor comprehendo voluptatum succedo accusamus sed ara.,3
6,,,119,Perspiciatis arto mollitia audio sponte valetudo curtus cursus.,Full Stack,Termes cultura virgo est abeo valetudo abeo copiose territo.,1
7,131.0,6706701a98ac07710c36af41,14,Adsidue combibo texo nemo.,Data Science,Tergiversatio apparatus depopulo auxilium denique tametsi tenax.,1
8,114.0,6706701a98ac07710c36af6a,112,Torqueo suscipio temeritas depulso temptatio quia nemo est.,Data Science,Tricesimus amo deporto basium triumphus.,2
9,153.0,6706701a98ac07710c36af57,72,Clibanus magni ab conventus deputo aegrotatio.,Data Science,Bis vespillo clarus eaque ascisco voluptatem at.,1
10,,,185,Audio ustulo deserunt conforto delectatio theologus officiis tripudio undique conatus.,Data Engineering,Tamisium cito sortitus laudantium acer dolor vesica cresco titulus.,5
11,26.0,6706701a98ac07710c36af60,10,Bellicus adversus nisi.,Data Engineering,Angulus solium dolorem stabilis atqui utilis.,3
12,189.0,6706701a98ac07710c36afbf,222,Territo cupiditate utique carmen urbs vociferor defaeco.,Data Engineering,Defero aegrus deripio defungo auctor tego patria confido certe.,1
13,123.0,6706701a98ac07710c36af4c,34,Culpa admoveo ascit claustrum viriliter apparatus unus iure alii.,Data Science,Quos comptus caveo acidus eius nisi comis.,4
14,102.0,6706701a98ac07710c36af3c,171,Canis trepide tibi nulla velut talus certus vinculum textus.,Data Engineering,Desparatus vehemens odit conqueror solum video patruus.,4
15,,,272,Tondeo utpote textus a dolorem conqueror caelum clam suasoria non.,Full Stack,Aspernatur amitto suppono talis thesis amplitudo animi.,4
16,133.0,6706701a98ac07710c36aec6,238,Basium appello clam tunc solitudo.,Full Stack,Veniam desolo sodalitas annus.,3
17,129.0,6706701a98ac07710c36af8a,2,Tardus acquiro suffragium.,Full Stack,Perferendis textor ultra creptio.,5
18,55.0,6706701a98ac07710c36af7f,13,Cilicium triumphus terga supplanto perferendis.,Data Science,Alius corrupti vereor nulla.,3
19,9.0,6706701a98ac07710c36af50,106,Nulla nostrum barba degero doloremque dignissimos.,Data Engineering,Libero correptius sit tenus.,4
20,9.0,6706701a98ac07710c36af50,39,Sustineo repellat vehemens aspernatur audax vallum omnis.,Full Stack,Socius tamdiu voluptatibus utor ipsa acervus congregatio vetus turpis.,5
21,6.0,6706701a98ac07710c36afb9,131,Consuasor decumbo laborum vapulus viduo uter amitto.,Data Science,Argumentum tepidus ullus arguo.,1
22,83.0,6706701a98ac07710c36af26,78,Viriliter valde titulus culpa summa mollitia verecundia bellum compello.,Full Stack,Defendo custodia tui.,4
23,,,182,Tantillus aliqua apto abutor cognomen.,Data Engineering,Cras aeneus astrum conscendo venio triumphus somnus apto.,5
24,,,268,Charisma abutor ascisco absorbeo denuncio.,Data Engineering,Tandem crux ut vesper agnitio dens adeptio arbor blandior.,1
25,25.0,6706701a98ac07710c36aeb9,28,Cupio somnus textor tutamen demergo itaque.,Full Stack,Celebrer illo speculum viridis decretum amicitia surgo excepturi autus.,5
26,,,110,Tersus anser corpus claudeo mollitia.,Full Stack,Statua absorbeo expedita solitudo ventosus ut tertius.,5
27,,,73,Centum supra communis.,Data Science,Timor totam vestigium aegrus aggredior absorbeo aqua umbra veritatis sophismata.,1
28,98.0,6706701a98ac07710c36af64,21,Patruus cognatus compello vita temporibus surculus decor ventito.,Data Engineering,Vespillo arcesso calco cariosus.,4
29,187.0,6706701a98ac07710c36aeae,112,Torqueo suscipio temeritas depulso temptatio quia nemo est.,Data Science,Tabernus adficio sonitus depereo theca aduro cometes aequitas sponte.,5
30,,,234,Suadeo cupiditas suus tametsi una ait callide.,Full Stack,Abundans cavus patria sui tego verus tot tantum tonsor.,5
31,57.0,6706701a98ac07710c36af14,90,Depereo maiores ullam cena.,Data Engineering,Vitae viriliter curtus auctor.,1
32,51.0,6706701a98ac07710c36af3e,61,Vomica decet adflicto conatus curiositas quod adsum acsi aeger.,Full Stack,Optio collum celer suscipit conculco aurum communis termes.,5
33,121.0,6706701a98ac07710c36af55,104,Credo benevolentia velociter candidus cibo tenax tot.,Data Engineering,Vulticulus annus communis.,2
34,4.0,6706701a98ac07710c36afc0,265,Vir verus apto.,Full Stack,Ventito uredo carmen.,4
35,60.0,6706701a98ac07710c36af15,249,Audentia suffoco comes temptatio suspendo canto capto admiratio varietas absens.,Data Engineering,Mollitia doloribus curia colo vita neque.,4
36,188.0,6706701a98ac07710c36aeef,277,Crapula spoliatio coma decretum stillicidium cui altus baiulus testimonium urbs.,Data Engineering,Deleniti deserunt paens subseco.,3
37,,,100,Suffoco arbustum claustrum aduro adfectus.,Data Engineering,Fuga delectatio summisse quos vestrum creber quam comitatus.,3
38,95.0,6706701a98ac07710c36aea9,139,Vulpes quas aduro subvenio vergo utroque.,Data Science,Vigor cupressus atavus tardus tendo denique torqueo dedico triduana civitas.,5
39,,,113,Bonus comburo pariatur apparatus.,Full Stack,Spiritus agnosco crustulum asporto somniculosus baiulus territo surgo calco.,3
40,186.0,6706701a98ac07710c36af5c,249,Audentia suffoco comes temptatio suspendo canto capto admiratio varietas absens.,Data Engineering,Demum sublime acer corrumpo umerus umerus cumque.,4
41,,,154,Cena utilis dolor venustas cruciamentum ubi conservo.,Full Stack,Officia taceo complectus annus.,2
42,2.0,6706701a98ac07710c36afa1,153,Cui vel comprehendo thymum defessus minus adflicto deinde canto sodalitas.,Data Science,Quasi supellex asperiores valens acsi.,4
43,,,7,Surculus claustrum strues credo desipio crastinus anser terga minus contigo.,Data Engineering,Adnuo apud cito deprecator.,2
44,11.0,6706701a98ac07710c36aed4,79,Casus necessitatibus carcer decor reiciendis adicio umquam ab collum considero.,Data Science,Accusator saepe textus hic decumbo amaritudo argumentum.,5
45,33.0,6706701a98ac07710c36af48,47,Colligo pauper cilicium deinde suadeo celer derelinquo celo repellat defessus.,Full Stack,Unus magnam valde cinis vesper necessitatibus earum.,4
46,153.0,6706701a98ac07710c36af57,275,Paens tersus admoveo umquam quidem derelinquo cenaculum turpis.,Data Engineering,Expedita vix cometes stella trans adhuc solvo.,5
47,43.0,6706701a98ac07710c36aeff,7,Surculus claustrum strues credo desipio crastinus anser terga minus contigo.,Data Engineering,Capio agnitio qui vulariter amplitudo aurum vulgaris sollicito.,3
48,,,98,Vir atqui saepe cras sopor.,Full Stack,Confido acer stips asperiores verto concido perspiciatis arbustum adipisci.,4
49,,,51,Tibi amoveo cubo ustilo dolorum compello arcus decipio debilito vallum.,Full Stack,Cubicularis vitiosus substantia crebro suffoco cibo basium.,3
50,,,191,Solio vestigium balbus dens.,Full Stack,Absque suasoria adfectus aqua consuasor.,4
51,,,271,Suppono vesper subvenio vero capio suspendo desidero pariatur.,Full Stack,Voluptas aeternus aeger validus reiciendis accusator auxilium curtus verbera.,3
52,158.0,6706701a98ac07710c36aebd,198,Claustrum crur triumphus approbo id vere.,Data Engineering,Suppono laudantium dicta.,3
53,76.0,6706701a98ac07710c36af73,46,Arbor sponte suscipio barba paens amet clamo bestia depopulo.,Full Stack,Aedificium error votum volutabrum reiciendis color consuasor toties error.,2
54,,,157,Statim usitas voveo adsum cognomen eaque.,Data Engineering,Alo vix accedo vallum civis ultra.,2
55,42.0,6706701a98ac07710c36aefc,159,Cultellus depono sublime articulus rerum terra.,Full Stack,Aeternus unde adicio cursim aperiam tollo nihil.,3
56,183.0,6706701a98ac07710c36af8c,35,Laboriosam terra caelum odit talio chirographum velut vobis enim eligendi.,Data Science,Paulatim defendo turba taedium dapifer vindico thorax animi.,2
57,33.0,6706701a98ac07710c36af48,260,Adhaero verumtamen cribro tenax allatus beatus.,Full Stack,Trucido valens calamitas cernuus.,3
58,5.0,6706701a98ac07710c36af74,36,Allatus carcer aperte arto defessus cursus corrigo caput suffoco concedo.,Data Science,Decumbo vorago suadeo atrocitas peccatus degusto id voluntarius.,2
59,,,291,Decretum decretum deficio deripio enim.,Full Stack,Clarus collum vilicus desidero bestia quae cervus vitiosus aliquid.,4
60,120.0,6706701a98ac07710c36afb6,155,Causa uter decimus sulum.,Full Stack,Voro cresco sperno facilis venustas adsuesco civis vae audeo coepi.,1
61,,,277,Crapula spoliatio coma decretum stillicidium cui altus baiulus testimonium urbs.,Data Engineering,Tabella degusto vivo coruscus deporto accusamus corrupti atqui depromo.,3
62,,,27,Advenio desparatus amoveo autem curriculum patior volaticus autem speciosus calculus.,Full Stack,Turba conitor vomito sophismata careo architecto consequatur adeptio molestias.,4
63,4.0,6706701a98ac07710c36afc0,261,Vestrum molestiae crinis vos nostrum.,Data Science,Vergo commemoro spectaculum dolorum.,5
64,,,263,Aetas comprehendo delectatio delectus ciminatio crinis corroboro aequitas animi.,Data Science,Doloremque cultura attollo strenuus adipiscor corroboro.,2
65,,,110,Tersus anser corpus claudeo mollitia.,Full Stack,Demonstro sublime vinco armarium cometes carpo error.,2
66,,,294,Venia cognomen vaco degero laudantium quidem decens veritatis.,Full Stack,Admitto solitudo aspicio arcus altus deficio curiositas.,4
67,,,100,Suffoco arbustum claustrum aduro adfectus.,Data Engineering,Consequuntur absorbeo caterva angustus.,3
68,,,236,Conduco adsidue tonsor id.,Data Science,Crur carcer conturbo usus.,1
69,,,247,Cilicium cattus accusator vitae esse vado stillicidium.,Full Stack,Utor fugiat claro comparo vere.,5
70,145.0,6706701a98ac07710c36af06,88,Constans certe stultus dolorum acceptus amplus vitiosus chirographum.,Full Stack,Tonsor ars optio autus supellex tepesco stabilis.,4
71,,,33,Decor abscido temporibus.,Full Stack,Studio delibero aequitas ipsam carmen ventosus delicate.,1
72,85.0,6706701a98ac07710c36af4d,90,Depereo maiores ullam cena.,Data Engineering,Tum accommodo infit desipio demoror depulso claro demonstro amissio charisma.,5
73,191.0,6706701a98ac07710c36af2e,146,Eveniet harum tutis.,Full Stack,Curiositas uterque abstergo quia repudiandae pax desolo quae decet.,2
74,,,239,Quo chirographum spero.,Full Stack,Aveho neque pauci.,2
75,57.0,6706701a98ac07710c36af14,125,Arbitro summa vesica celer corrumpo laborum quod.,Data Science,Clamo unus aestivus adamo eaque color.,2
76,182.0,6706701a98ac07710c36aeb5,290,Averto hic cubo vae studio vorago curtus antea sollicito utilis.,Data Engineering,Depereo nulla tempus amoveo auditor vita aegre.,2
77,16.0,6706701a98ac07710c36af59,118,Combibo admiratio suffoco.,Data Science,Curvo vir defendo terga torqueo eveniet assentator necessitatibus depromo.,5
78,,,44,Comparo statua rem complectus aetas aperiam vestigium.,Full Stack,Bibo curis consequatur veniam deludo bellicus ratione agnitio brevis.,1
79,,,133,Aufero defleo amita dolor.,Data Engineering,Iusto circumvenio libero confero voluptate aequus.,3
80,26.0,6706701a98ac07710c36af60,281,Appello patruus curis verbera crudelis reprehenderit curriculum torrens cedo commodi.,Data Engineering,Video utilis cedo expedita aedificium.,5
81,195.0,6706701a98ac07710c36af3b,216,Vestrum altus crastinus cattus.,Full Stack,Officiis verto appono illo aggero vesco stabilis.,5
82,,,264,Adipiscor volaticus certe sollers.,Data Engineering,Deripio placeat aspernatur ut.,2
83,60.0,6706701a98ac07710c36af15,134,Conturbo credo consectetur adopto viscus aggredior.,Full Stack,Amplexus beneficium degusto in animi benevolentia comprehendo uter eum.,2
84,,,141,Cuppedia tabernus accedo quibusdam vereor amitto.,Data Engineering,Toties doloremque natus.,2
85,74.0,6706701a98ac07710c36af65,181,Cupiditas vacuus ratione amet aestivus vorago sollers.,Full Stack,Timidus attonbitus suus neque cursim suppellex carcer dignissimos.,1
86,,,147,Vesco velit appono.,Full Stack,Atqui stultus adipiscor deporto caecus optio expedita.,1
87,,,23,Convoco vulgus casus bellicus aspernatur cognomen temeritas tenax celo.,Data Engineering,Vulgo ascisco solus aliqua voluptate perferendis cupio cotidie.,1
88,,,264,Adipiscor volaticus certe sollers.,Data Engineering,Tantillus videlicet synagoga.,3
89,,,162,Cunctatio apostolus confero eum auxilium.,Data Engineering,Surculus demoror minus admiratio vinco.,4
90,,,186,Ante crastinus vinculum solutio molestiae collum suspendo corrigo laudantium aro.,Full Stack,Abeo autus cornu surgo tempus conduco causa tabernus cribro.,3
91,73.0,6706701a98ac07710c36afb1,4,Benevolentia alter adinventitias ago clementia vilis.,Data Engineering,Taceo curia vestrum totidem aegre.,2
92,,,152,Minima altus sed aliquam theca barba acceptus tempus ventito vesper.,Data Science,Demoror derelinquo subseco tabernus.,2
93,,,117,Vehemens cornu crudelis voluptatem aegrus virtus cohaero vacuus.,Data Engineering,Accusamus consuasor attollo absum sponte sursum aliqua.,4
94,9.0,6706701a98ac07710c36af50,168,Tristis venia explicabo deprimo.,Full Stack,Creator vado sub supra stillicidium aequus unus aegre ulciscor.,2
95,,,80,Accusamus allatus demoror.,Full Stack,Tunc velociter expedita adipiscor velum.,2
96,39.0,6706701a98ac07710c36af40,66,Molestiae civitas convoco accusator arbitro compono sequi acervus.,Full Stack,Approbo cupio nihil adopto theatrum saepe aperio tenus.,3
97,,,287,Conatus vetus defungo aduro nemo corrupti molestiae.,Data Science,Textor suffoco cupressus cito ubi summa cotidie varius adsuesco suggero.,2
98,142.0,6706701a98ac07710c36af2a,228,Casso validus maiores decretum combibo decimus sponte tametsi capto.,Data Science,Deprimo spiculum astrum defaeco temporibus.,3
99,145.0,6706701a98ac07710c36af06,85,Comminor tondeo audeo enim compello degenero vomito succedo.,Data Engineering,Desidero bardus audentia vulgus pectus necessitatibus.,4
100,131.0,6706701a98ac07710c36af41,158,Vomica deleo cotidie contabesco incidunt.,Data Engineering,Cariosus voluptas admiratio approbo cado conservo voluptate acies.,5
101,43.0,6706701a98ac07710c36aeff,210,Cursus coepi ustulo optio deporto.,Full Stack,Acervus approbo beneficium contigo contigo pariatur spiritus error creator amicitia.,2
102,39.0,6706701a98ac07710c36af40,162,Cunctatio apostolus confero eum auxilium.,Data Engineering,Numquam adinventitias cibus quasi defungo absorbeo laboriosam vulgaris.,1
103,46.0,6706701a98ac07710c36afc6,161,Coaegresco stultus ea ancilla cognatus alioqui comminor cruciamentum strues solus.,Data Science,Ultio adfero impedit cresco uterque.,4
104,69.0,6706701a98ac07710c36af0e,44,Comparo statua rem complectus aetas aperiam vestigium.,Full Stack,Decretum creber caelestis artificiose debilito ars.,3
105,125.0,6706701a98ac07710c36aecd,32,Comburo somnus creptio derideo cunctatio tumultus agnosco ater.,Data Science,Traho canto constans cursus umquam aegre decet certe comedo.,1
106,4.0,6706701a98ac07710c36afc0,102,Quaerat solutio adipiscor supellex peccatus.,Full Stack,Termes contego nisi tristis tamdiu quasi theca.,4
107,,,200,Cras terminatio veritatis.,Data Science,Allatus angelus contra viriliter repudiandae sol.,5
108,189.0,6706701a98ac07710c36afbf,241,Veritatis ventus eaque abstergo canis colligo.,Data Engineering,Vilicus congregatio desparatus.,4
109,61.0,6706701a98ac07710c36af44,9,Rem theca aranea porro utroque attero textilis crinis validus.,Data Science,Careo cupressus voluptatum acies delectatio vinco bis termes infit.,2
110,19.0,6706701a98ac07710c36aee5,165,Vilicus totidem culpa statim.,Data Engineering,Articulus defleo creo tametsi.,2
111,174.0,6706701a98ac07710c36aee2,299,Comis debitis suppellex mollitia summa tergiversatio patruus recusandae commodo umquam.,Data Science,Vestrum cerno vinitor verumtamen explicabo.,5
112,15.0,6706701a98ac07710c36aedc,208,Amplitudo venio aqua congregatio degero depopulo.,Data Engineering,Celer vinum cinis cinis aliqua cognatus.,4
113,116.0,6706701a98ac07710c36afba,216,Vestrum altus crastinus cattus.,Full Stack,Vereor vos somnus comes tum tum vacuus adsidue charisma.,5
114,105.0,6706701a98ac07710c36aeab,108,Eos aliqua delinquo decor odit cogito.,Data Science,Tondeo demoror adsum.,1
115,73.0,6706701a98ac07710c36afb1,129,Deduco ante curto.,Data Science,Sum stabilis commodi et ante.,2
116,,,226,Depraedor curso eum canis virgo spiritus.,Data Engineering,Fugit sollers umerus conspergo ago ver caelestis acsi.,1
117,103.0,6706701a98ac07710c36aec1,231,Balbus deleniti comedo contego sonitus pecto utrimque constans id abduco.,Data Science,Dapifer studio sperno vulnero beneficium sufficio debitis.,1
118,,,169,Caste cervus dolore coepi angustus commodi pel.,Data Science,Quaerat defluo demoror tabula crepusculum aureus coruscus.,3
119,111.0,6706701a98ac07710c36af7d,27,Advenio desparatus amoveo autem curriculum patior volaticus autem speciosus calculus.,Full Stack,Magnam quae nostrum aduro crastinus.,1
120,150.0,6706701a98ac07710c36afa0,92,Subito soluta demitto debitis vestigium acceptus.,Data Engineering,Ventus amplitudo depopulo debeo canis dolore aperte.,1
121,,,256,Textilis aspicio celo denego.,Data Engineering,Candidus voluptatum utique delicate.,3
122,,,100,Suffoco arbustum claustrum aduro adfectus.,Data Engineering,Compello summisse ambitus theca admiratio cunabula odio comprehendo.,3
123,133.0,6706701a98ac07710c36aec6,66,Molestiae civitas convoco accusator arbitro compono sequi acervus.,Full Stack,Corrigo amet vir validus compello verumtamen.,4
124,,,294,Venia cognomen vaco degero laudantium quidem decens veritatis.,Full Stack,Congregatio aegre solitudo tenus carus tricesimus.,4
125,74.0,6706701a98ac07710c36af65,10,Bellicus adversus nisi.,Data Engineering,Compono deputo crudelis audentia thorax vis confugo sodalitas apud angulus.,4
126,,,243,Crinis suus confugo confero corrigo.,Full Stack,Stillicidium tametsi cultellus.,3
127,,,279,Conicio est canonicus consuasor calculus.,Data Engineering,Tenuis vulgivagus cribro tredecim decens comptus accusamus.,2
128,,,295,Totam tui acies corrumpo attero victoria adaugeo.,Data Engineering,Argentum velociter terror fugiat deduco tui caveo veritatis amet.,2
129,167.0,6706701a98ac07710c36afc8,200,Cras terminatio veritatis.,Data Science,Tergiversatio cado provident volaticus et defessus vita.,1
130,74.0,6706701a98ac07710c36af65,198,Claustrum crur triumphus approbo id vere.,Data Engineering,Quibusdam expedita crux.,4
131,33.0,6706701a98ac07710c36af48,19,Deleniti adhaero articulus blandior suffragium thema depulso demonstro curso.,Data Science,Cerno peior ultra.,5
132,25.0,6706701a98ac07710c36aeb9,137,Abeo crapula vis tamisium similique benevolentia suspendo.,Data Science,Validus defendo cetera.,5
133,121.0,6706701a98ac07710c36af55,268,Charisma abutor ascisco absorbeo denuncio.,Data Engineering,Cupiditas crustulum esse ocer defendo vos trado sto.,1
134,,,269,Arca decumbo corpus via adulatio volva solus suadeo necessitatibus dolor.,Data Science,Absorbeo curto attonbitus cotidie assumenda caveo.,5
135,102.0,6706701a98ac07710c36af3c,46,Arbor sponte suscipio barba paens amet clamo bestia depopulo.,Full Stack,Coerceo comprehendo aeger delinquo annus.,4
136,175.0,6706701a98ac07710c36af8d,213,Corroboro temeritas cattus spargo impedit defessus adsum consectetur uxor.,Data Science,Defessus conicio acquiro asper teres correptius.,1
137,196.0,6706701a98ac07710c36afa8,241,Veritatis ventus eaque abstergo canis colligo.,Data Engineering,Adsidue demonstro decretum quos delectatio.,3
138,86.0,6706701a98ac07710c36af8b,280,Theologus velut calco aeger dicta.,Full Stack,Trans tergum demo vulgo perferendis beneficium taceo.,2
139,63.0,6706701a98ac07710c36af56,261,Vestrum molestiae crinis vos nostrum.,Data Science,Delicate aggredior adinventitias civis conspergo ascisco debilito suppellex considero minima.,5
140,72.0,6706701a98ac07710c36afb4,296,Adulescens centum tempus sunt vita certe facere temperantia infit.,Full Stack,Dolores deleo sublime attonbitus.,4
141,63.0,6706701a98ac07710c36af56,202,Dapifer tempore vomer facilis.,Full Stack,Deinde ex vero vorax ad consequuntur.,5
142,176.0,6706701a98ac07710c36af69,276,Deleniti videlicet thymbra clam acer argumentum benigne aequus.,Data Engineering,Cerno decimus alius umbra corpus carcer totam censura quos iure.,3
143,84.0,6706701a98ac07710c36af76,273,Articulus comptus culpa.,Data Engineering,Tollo utroque cohibeo.,5
144,,,72,Clibanus magni ab conventus deputo aegrotatio.,Data Science,Tredecim patria comedo amiculum vilis usque.,5
145,35.0,6706701a98ac07710c36afbc,179,Tandem blanditiis adsum admitto molestias vicissitudo.,Data Science,Vester canonicus adimpleo laudantium.,3
146,168.0,6706701a98ac07710c36af7b,296,Adulescens centum tempus sunt vita certe facere temperantia infit.,Full Stack,Confugo tolero vito agnosco amicitia abstergo aspernatur adflicto.,3
147,,,125,Arbitro summa vesica celer corrumpo laborum quod.,Data Science,Agnitio illum comparo crinis esse cariosus combibo vestigium.,3
148,,,89,Inventore voluptas aliqua spes cogo vitae quam.,Data Engineering,Viduo temeritas arbitro cinis.,5
149,1.0,6706701a98ac07710c36af36,275,Paens tersus admoveo umquam quidem derelinquo cenaculum turpis.,Data Engineering,Cursim corporis decumbo assentator amoveo auctor.,3
150,132.0,6706701a98ac07710c36af35,266,Tubineus esse aliqua substantia sol armarium aveho.,Full Stack,Qui curis thorax cetera vos cauda sollicito statua degenero tandem.,1
151,,,175,Fuga certe cura soleo officia.,Data Science,Defluo ipsa beatae cariosus thesis tondeo spargo.,1
152,112.0,6706701a98ac07710c36af2c,282,Volup tredecim deprecator blanditiis dolor.,Data Engineering,Vis tremo coepi cohibeo demum celebrer cimentarius.,2
153,,,23,Convoco vulgus casus bellicus aspernatur cognomen temeritas tenax celo.,Data Engineering,Aptus vestrum ullam vix ex arca tyrannus tui.,4
154,136.0,6706701a98ac07710c36af79,229,Aegre tribuo voro depraedor ipsam defleo conatus verecundia aer.,Data Engineering,Blandior bos ars denuo consuasor.,4
155,,,100,Suffoco arbustum claustrum aduro adfectus.,Data Engineering,Conservo tabernus crustulum certus.,4
156,141.0,6706701a98ac07710c36af2d,4,Benevolentia alter adinventitias ago clementia vilis.,Data Engineering,Ea provident amplus tot depono.,5
157,,,124,Alias vaco comparo vinco ipsam considero.,Data Engineering,Peior artificiose crudelis turpis.,1
158,50.0,6706701a98ac07710c36afc5,205,Alienus ara vestrum stipes.,Data Science,Creator repellendus decor colo solio vinum possimus.,1
159,55.0,6706701a98ac07710c36af7f,187,Quas maxime antea uxor decipio deprecator quisquam totus volva eligendi.,Data Science,Ventito cotidie succedo apparatus quas.,3
160,20.0,6706701a98ac07710c36af09,9,Rem theca aranea porro utroque attero textilis crinis validus.,Data Science,Decor expedita conqueror adfero arcesso.,3
161,,,48,Vix accusamus suasoria suppono.,Full Stack,Arcus cresco ancilla damno.,3
162,,,168,Tristis venia explicabo deprimo.,Full Stack,Usus sol adsidue vetus abeo cimentarius contra totus ara socius.,4
163,30.0,6706701a98ac07710c36af0b,79,Casus necessitatibus carcer decor reiciendis adicio umquam ab collum considero.,Data Science,Spiritus sui talio clementia iste velum ratione uberrime.,5
164,142.0,6706701a98ac07710c36af2a,286,Harum admoneo subseco coniuratio turba subito.,Data Science,Asporto adsidue abbas argumentum vulgaris.,1
165,166.0,6706701a98ac07710c36af37,90,Depereo maiores ullam cena.,Data Engineering,Sumo itaque beatus a adamo.,4
166,,,121,Suffoco cubo conqueror reiciendis cicuta eius verbera vir arto.,Data Science,Urbs comburo deduco thymum canis votum acer.,4
167,118.0,6706701a98ac07710c36af04,205,Alienus ara vestrum stipes.,Data Science,Sonitus coepi curtus.,4
168,10.0,6706701a98ac07710c36af7c,187,Quas maxime antea uxor decipio deprecator quisquam totus volva eligendi.,Data Science,Venia ea confido.,4
169,,,226,Depraedor curso eum canis virgo spiritus.,Data Engineering,Cito atqui cupressus molestiae paulatim tabella claro amitto vacuus.,2
170,,,224,Dolorem quae correptius demens.,Data Science,Vado in adfectus.,4
171,,,38,Thesaurus claudeo aeneus audio voluptatum aggredior.,Full Stack,Aperte nisi peccatus appello ver talis strenuus.,2
172,110.0,6706701a98ac07710c36af89,82,Articulus accommodo adopto cohaero utroque vomer clamo abscido depopulo.,Data Engineering,Decens vulticulus facilis.,3
173,,,20,Antiquus ullam peior terminatio ago absens.,Data Science,Subseco tabula decor arguo.,5
174,149.0,6706701a98ac07710c36af25,80,Accusamus allatus demoror.,Full Stack,Virtus quos vulgus ater torqueo debilito absens aedificium voluptates testimonium.,1
175,125.0,6706701a98ac07710c36aecd,177,Aduro ara arma.,Data Engineering,Tolero contra traho vicinus canonicus saepe quod volup laudantium.,1
176,,,176,Tardus quae teres iste administratio repudiandae trans sit adhaero apparatus.,Data Science,Antea super auxilium auditor alter summopere soleo capitulus temptatio.,1
177,,,177,Aduro ara arma.,Data Engineering,Terra advenio sol deorsum suadeo.,5
178,,,278,Suppono conventus libero.,Full Stack,Toties vesper spoliatio delibero itaque triduana arx cunabula et.,5
179,,,263,Aetas comprehendo delectatio delectus ciminatio crinis corroboro aequitas animi.,Data Science,Paulatim curtus illum sol acquiro bestia arbustum sulum tardus sub.,2
180,88.0,6706701a98ac07710c36af0c,267,Coruscus consequatur ambulo subseco teres villa conduco valens carbo videlicet.,Full Stack,Sortitus creo antepono claustrum.,4
181,,,223,Totidem patrocinor hic.,Data Engineering,Ullam adiuvo volaticus cornu conscendo angelus subito altus barba concido.,5
