feedbackKey,userKey,userId,learningMaterialKey,title,department,feedback,rating
182,140.0,6706701a98ac07710c36aead,258,Cogito uredo defaeco spectaculum turpis tamdiu.,Data Engineering,Thalassinus iusto et iusto votum volo contra voluptas patruus temperantia.,3
183,,,96,Turba vetus tandem.,Data Engineering,Inventore dapifer conatus caelestis.,4
184,31.0,6706701a98ac07710c36afb0,137,Abeo crapula vis tamisium similique benevolentia suspendo.,Data Science,Tabgo nulla calculus teneo aut umbra.,3
185,,,276,Deleniti videlicet thymbra clam acer argumentum benigne aequus.,Data Engineering,Vomito velum ventito antepono tersus tondeo deprimo suppono confugo censura.,1
186,83.0,6706701a98ac07710c36af26,219,Harum degenero angulus vilitas.,Data Engineering,Nulla capillus coma cogo corroboro antepono alioqui pauci.,1
187,80.0,6706701a98ac07710c36aef4,35,Laboriosam terra caelum odit talio chirographum velut vobis enim eligendi.,Data Science,Accendo consequuntur alius itaque sui averto bis illum spiritus.,4
188,86.0,6706701a98ac07710c36af8b,224,Dolorem quae correptius demens.,Data Science,Aequitas surculus absum undique adeptio vestigium crapula tribuo aeger.,5
189,41.0,6706701a98ac07710c36afa2,87,Terreo tamisium conturbo taceo torqueo territo brevis conatus stultus.,Data Engineering,Talio trado contra.,3
190,126.0,6706701a98ac07710c36aea7,52,Summa defleo statim creator stillicidium.,Full Stack,Doloremque timidus stillicidium.,5
191,21.0,6706701a98ac07710c36aee0,132,Acervus curso ambulo thorax.,Full Stack,Amiculum contego tamisium subito apud altus cavus talus vomer arbustum.,4
192,68.0,6706701a98ac07710c36af5f,45,Casus cursim libero adnuo amitto rerum inflammatio terra.,Full Stack,Excepturi admitto atrocitas consectetur censura vado tepesco coma ciminatio.,4
193,155.0,6706701a98ac07710c36af32,231,Balbus deleniti comedo contego sonitus pecto utrimque constans id abduco.,Data Science,Tripudio fuga consectetur venustas vallum.,3
194,139.0,6706701a98ac07710c36af02,203,Contigo cunae tyrannus.,Data Science,Vester dedecor thesis anser accedo articulus clam volaticus tabula.,1
195,,,243,Crinis suus confugo confero corrigo.,Full Stack,Tepesco adulatio villa tumultus tepesco censura adficio admoveo territo charisma.,2
196,10.0,6706701a98ac07710c36af7c,162,Cunctatio apostolus confero eum auxilium.,Data Engineering,Infit verecundia torqueo comburo sollicito adulatio thalassinus.,1
197,73.0,6706701a98ac07710c36afb1,3,Cohibeo quia arbustum voluptatibus audio quae caritas.,Data Engineering,Benigne avarus civis sum aeternus color tui sodalitas.,1
198,179.0,6706701a98ac07710c36af52,193,Sed fugit tui officiis.,Data Science,Vociferor abduco error tonsor tardus aliquam inflammatio suggero.,5
199,,,186,Ante crastinus vinculum solutio molestiae collum suspendo corrigo laudantium aro.,Full Stack,Minus amet consequuntur abbas modi repudiandae utpote.,4
200,195.0,6706701a98ac07710c36af3b,5,Cupressus ara cito ante veritas reprehenderit tamquam ter.,Full Stack,Canis admoneo titulus atque confido deficio suasoria voluptatibus.,1
201,137.0,6706701a98ac07710c36af3d,115,Delego cognomen patior cotidie cicuta spectaculum verus cetera.,Data Science,Admoneo congregatio valens maiores beatae ustulo crur stips praesentium iste.,5
202,74.0,6706701a98ac07710c36af65,121,Suffoco cubo conqueror reiciendis cicuta eius verbera vir arto.,Data Science,Vir aestivus aiunt.,5
203,107.0,6706701a98ac07710c36af90,277,Crapula spoliatio coma decretum stillicidium cui altus baiulus testimonium urbs.,Data Engineering,Canis torrens cena acies umerus ubi laudantium.,3
204,,,134,Conturbo credo consectetur adopto viscus aggredior.,Full Stack,Ab ventosus arca statua absens verto tempora.,5
205,,,162,Cunctatio apostolus confero eum auxilium.,Data Engineering,Aliquam vulnero necessitatibus.,1
206,164.0,6706701a98ac07710c36af1e,285,Vilis culpa tantum unus caput suasoria.,Data Science,Vulariter eaque desparatus vesco absorbeo decor.,2
207,145.0,6706701a98ac07710c36af06,215,Recusandae venustas avarus solum.,Data Engineering,At adipiscor sodalitas.,1
208,77.0,6706701a98ac07710c36af94,82,Articulus accommodo adopto cohaero utroque vomer clamo abscido depopulo.,Data Engineering,Desidero uberrime carbo derideo campana praesentium celer vestigium.,1
209,186.0,6706701a98ac07710c36af5c,13,Cilicium triumphus terga supplanto perferendis.,Data Science,Tracto thesaurus cattus.,3
210,50.0,6706701a98ac07710c36afc5,34,Culpa admoveo ascit claustrum viriliter apparatus unus iure alii.,Data Science,Cauda tendo volutabrum atrox decumbo dolore deduco vobis labore.,4
211,,,34,Culpa admoveo ascit claustrum viriliter apparatus unus iure alii.,Data Science,Vulgivagus confugo accommodo arto torrens quas creber coniuratio utor.,3
212,4.0,6706701a98ac07710c36afc0,8,Utilis creber attonbitus quo enim.,Data Engineering,Somniculosus thermae decretum totidem cito consequuntur arceo cohors.,4
213,135.0,6706701a98ac07710c36af20,105,Synagoga anser credo illo thema arx ad supellex ulciscor assumenda.,Data Engineering,Aro turba totidem adflicto curtus valetudo canis aperte acquiro uredo.,4
214,31.0,6706701a98ac07710c36afb0,274,Apud dens absens.,Data Engineering,Vilicus perspiciatis peior.,2
215,,,212,Aedificium articulus ascit ter umbra timor curvo aequus advenio accommodo.,Data Science,Ubi tabula subnecto socius utrimque deficio decet.,3
216,116.0,6706701a98ac07710c36afba,73,Centum supra communis.,Data Science,Non appositus somniculosus clam commodi.,4
217,33.0,6706701a98ac07710c36af48,298,Stipes at celebrer censura contigo tenus desipio utrum cunae.,Data Science,Sophismata tersus aegrotatio verbera deporto valeo annus molestiae conicio articulus.,2
218,69.0,6706701a98ac07710c36af0e,291,Decretum decretum deficio deripio enim.,Full Stack,Urbs teres voluntarius delinquo audacia subito utor usque comptus.,3
219,,,209,Theatrum pauci vero apparatus antiquus.,Data Science,Apostolus complectus supplanto iste tantum error.,4
220,104.0,6706701a98ac07710c36aeb8,118,Combibo admiratio suffoco.,Data Science,Urbs coepi umerus soleo bos corporis appono sufficio aiunt.,2
221,,,4,Benevolentia alter adinventitias ago clementia vilis.,Data Engineering,Tabula cunabula tergeo cogito coerceo vicinus cado veritatis aro cohors.,4
222,,,28,Cupio somnus textor tutamen demergo itaque.,Full Stack,Corrupti molestiae damno tres sponte canis decet nihil creator comes.,5
223,23.0,6706701a98ac07710c36af31,250,Comptus vae ventosus contra artificiose possimus comminor.,Full Stack,Votum vel altus quisquam arma thalassinus tum surgo celo.,1
224,162.0,6706701a98ac07710c36af77,20,Antiquus ullam peior terminatio ago absens.,Data Science,Et cresco amita adopto victus tener capio stipes.,4
225,,,95,Synagoga aestus sodalitas vos vulgaris decet tyrannus.,Full Stack,Tripudio vox aggero.,1
226,28.0,6706701a98ac07710c36af71,95,Synagoga aestus sodalitas vos vulgaris decet tyrannus.,Full Stack,Decens depraedor dolorem vester coniecto suppono debitis.,5
227,120.0,6706701a98ac07710c36afb6,274,Apud dens absens.,Data Engineering,Caritas conturbo voluptatem consequuntur amplus.,2
228,16.0,6706701a98ac07710c36af59,92,Subito soluta demitto debitis vestigium acceptus.,Data Engineering,Sopor quidem aperiam allatus vere.,2
229,,,256,Textilis aspicio celo denego.,Data Engineering,Paens brevis aspernatur curso.,3
230,160.0,6706701a98ac07710c36aefe,114,Ver vix speculum arcus sumo accendo subvenio acies urbanus magni.,Data Engineering,Ver adeptio votum adopto.,4
231,,,140,Audeo voluptatem molestias apostolus tergiversatio culpo.,Data Science,Adsum sol antea utor spiculum deputo eligendi aufero tumultus.,2
232,,,262,Apto vulariter volaticus perferendis desparatus color vilicus.,Data Science,Adulatio degusto umerus subnecto delinquo tabernus.,2
233,4.0,6706701a98ac07710c36afc0,260,Adhaero verumtamen cribro tenax allatus beatus.,Full Stack,Custodia vulariter capillus unde adulescens.,5
234,31.0,6706701a98ac07710c36afb0,205,Alienus ara vestrum stipes.,Data Science,Arguo dolores decet utpote aetas temperantia delectus vulariter.,5
235,157.0,6706701a98ac07710c36aeb0,111,Cotidie talio verus temperantia calcar dolorum ascit vivo.,Data Science,Aperio aestus conculco traho autus accusantium.,5
236,74.0,6706701a98ac07710c36af65,195,Tantillus maxime defendo conturbo eligendi spes vox catena statim placeat.,Data Science,Vos desolo corpus creta tamisium utpote denuncio sperno.,3
237,96.0,6706701a98ac07710c36aeec,86,Animus acies vulgivagus ad cursim amo pariatur constans ambulo.,Full Stack,Taedium mollitia abscido pectus admoneo eveniet.,5
238,156.0,6706701a98ac07710c36aec0,181,Cupiditas vacuus ratione amet aestivus vorago sollers.,Full Stack,Explicabo vaco laborum alii possimus arbustum callide varietas aurum eius.,1
239,87.0,6706701a98ac07710c36af81,296,Adulescens centum tempus sunt vita certe facere temperantia infit.,Full Stack,Concedo amitto timidus stultus.,1
240,12.0,6706701a98ac07710c36af4f,270,Certe corpus vulnus sumo congregatio animi soluta teres.,Data Science,Stipes brevis viscus tempora statim tergeo amaritudo.,2
241,130.0,6706701a98ac07710c36aebe,130,Commemoro admoveo tergum defluo attonbitus xiphias argentum umquam apostolus strenuus.,Data Engineering,Depereo commodo vesica commodi.,3
242,,,52,Summa defleo statim creator stillicidium.,Full Stack,Vito articulus caelum adfero veniam ex cumque qui dapifer.,1
243,,,293,Vicinus aegrotatio tam atavus cariosus venustas tremo terebro.,Full Stack,Custodia necessitatibus vir.,1
244,157.0,6706701a98ac07710c36aeb0,145,Pel sui aspernatur trado cultellus cruciamentum patruus despecto cognomen.,Data Science,Tibi vergo umerus arto degusto volutabrum enim carpo denique conculco.,3
245,138.0,6706701a98ac07710c36aec8,193,Sed fugit tui officiis.,Data Science,Inventore solitudo corrumpo cunctatio sopor thema atqui confido vicinus.,5
246,44.0,6706701a98ac07710c36af1c,36,Allatus carcer aperte arto defessus cursus corrigo caput suffoco concedo.,Data Science,Allatus damnatio viduo thesis sperno aer strues casso conturbo.,2
247,,,137,Abeo crapula vis tamisium similique benevolentia suspendo.,Data Science,Apud bene bellum auxilium umquam antea stultus.,5
248,130.0,6706701a98ac07710c36aebe,129,Deduco ante curto.,Data Science,Tergum decens tener apto clarus super amiculum truculenter.,4
249,164.0,6706701a98ac07710c36af1e,272,Tondeo utpote textus a dolorem conqueror caelum clam suasoria non.,Full Stack,Odit sufficio terra.,3
250,,,163,Consequatur arbor laboriosam deripio trans.,Data Science,Suscipit aufero omnis.,1
251,37.0,6706701a98ac07710c36aea5,83,Capio coerceo fugit veritas patruus.,Data Engineering,Victoria iusto claro adicio decipio natus.,4
252,56.0,6706701a98ac07710c36af17,226,Depraedor curso eum canis virgo spiritus.,Data Engineering,Paulatim soleo comptus curis sint uredo tego repellat speculum.,5
253,159.0,6706701a98ac07710c36aec7,268,Charisma abutor ascisco absorbeo denuncio.,Data Engineering,Solitudo sollers theologus apparatus.,4
254,,,248,Degusto ait tantillus quidem.,Data Science,Aptus teneo cohibeo nulla absque saepe curo aperiam abutor.,3
255,,,190,Natus dedico spoliatio a cunabula soleo.,Data Engineering,Cohors voluptatibus quibusdam debilito artificiose repellat.,5
256,,,60,Cubicularis statim callide vapulus voveo corona velociter repellat voluptates.,Full Stack,Crapula aveho amicitia verbera alius crustulum.,3
257,51.0,6706701a98ac07710c36af3e,217,Comedo alo abscido.,Data Engineering,Nisi benigne terror placeat utor atavus ullam.,1
258,163.0,6706701a98ac07710c36af63,81,Ambitus sophismata dedecor ustulo tondeo altus vulgaris animadverto.,Data Science,Maiores caterva vado ratione vulnero sortitus cornu defessus earum.,2
259,31.0,6706701a98ac07710c36afb0,42,Tabernus fuga cornu audio verecundia.,Data Science,Vulnero amoveo amaritudo dolore beatus comedo modi credo.,5
260,60.0,6706701a98ac07710c36af15,110,Tersus anser corpus claudeo mollitia.,Full Stack,Bene ustulo depopulo argentum.,4
261,,,209,Theatrum pauci vero apparatus antiquus.,Data Science,Enim tergum sonitus dolorum.,3
262,,,199,Suggero deduco alienus.,Data Engineering,Aestivus facere civitas.,3
263,,,127,Tui synagoga cedo.,Full Stack,Despecto repellat non aro apud doloribus sustineo.,1
264,,,247,Cilicium cattus accusator vitae esse vado stillicidium.,Full Stack,Peior vinitor suus surculus depereo cauda cumque clamo.,5
265,177.0,6706701a98ac07710c36aeea,100,Suffoco arbustum claustrum aduro adfectus.,Data Engineering,Votum defleo sophismata ipsa comprehendo quaerat.,2
266,,,215,Recusandae venustas avarus solum.,Data Engineering,Molestiae velut non minus occaecati cohaero decipio tunc.,2
267,,,235,Demum alienus argumentum aro ut praesentium assentator subiungo.,Data Science,Adulatio capillus nulla atqui absens nulla.,3
268,,,2,Tardus acquiro suffragium.,Full Stack,Absque adicio venia ambulo tepidus caritas carus cattus absque creta.,2
269,,,291,Decretum decretum deficio deripio enim.,Full Stack,Tempore vere via depereo.,4
270,,,137,Abeo crapula vis tamisium similique benevolentia suspendo.,Data Science,Thermae convoco admiratio decor aut veritas una canis vulpes curtus.,5
271,,,111,Cotidie talio verus temperantia calcar dolorum ascit vivo.,Data Science,Curo terra villa trucido suppellex ustilo supplanto eveniet damno clementia.,1
272,,,290,Averto hic cubo vae studio vorago curtus antea sollicito utilis.,Data Engineering,Enim tres adversus acer.,5
273,103.0,6706701a98ac07710c36aec1,191,Solio vestigium balbus dens.,Full Stack,Accendo speciosus eligendi ullam auctus.,5
274,,,13,Cilicium triumphus terga supplanto perferendis.,Data Science,Vespillo sumptus abstergo inventore accusator in tabesco vilitas.,2
275,,,276,Deleniti videlicet thymbra clam acer argumentum benigne aequus.,Data Engineering,Aptus color facere desino.,5
276,42.0,6706701a98ac07710c36aefc,183,Catena arguo cupiditate angelus videlicet civis eligendi.,Full Stack,Curatio iusto subnecto.,3
277,167.0,6706701a98ac07710c36afc8,159,Cultellus depono sublime articulus rerum terra.,Full Stack,Ocer demergo defessus cito caute coerceo totam.,4
278,,,151,Tabula adicio thalassinus dignissimos caput vestigium tibi denuo una.,Data Engineering,Aliquam aestas magni sustineo odit eveniet rerum.,1
279,158.0,6706701a98ac07710c36aebd,234,Suadeo cupiditas suus tametsi una ait callide.,Full Stack,Crinis corpus tabesco delectatio.,3
280,32.0,6706701a98ac07710c36af24,110,Tersus anser corpus claudeo mollitia.,Full Stack,Quisquam suggero arto correptius arto ver alienus unde occaecati.,5
281,167.0,6706701a98ac07710c36afc8,24,Calco degusto confugo dapifer antepono capillus audacia casso volup.,Data Science,Terminatio uberrime vinitor.,2
282,,,271,Suppono vesper subvenio vero capio suspendo desidero pariatur.,Full Stack,Ager terminatio stipes ciminatio textor pecto nesciunt.,2
283,171.0,6706701a98ac07710c36aecf,202,Dapifer tempore vomer facilis.,Full Stack,Deporto dolor vivo veniam dicta tenuis audentia acerbitas cilicium.,4
284,,,164,Adiuvo ipsum delego virtus.,Full Stack,Vilis colligo comburo antepono viridis.,2
285,,,11,Vivo apostolus arguo.,Full Stack,Antiquus dicta ventosus.,3
286,21.0,6706701a98ac07710c36aee0,273,Articulus comptus culpa.,Data Engineering,Laudantium benigne bellum thermae.,3
287,,,174,Arbor porro illum creta annus acquiro utor atavus.,Data Engineering,Territo terror varius benigne est amor ipsa denuo vinitor.,3
288,26.0,6706701a98ac07710c36af60,146,Eveniet harum tutis.,Full Stack,Sublime apostolus baiulus.,3
289,,,122,Solus agnosco truculenter sto capitulus fugiat porro vicinus.,Data Engineering,Itaque pariatur carbo vilis adflicto.,3
290,139.0,6706701a98ac07710c36af02,215,Recusandae venustas avarus solum.,Data Engineering,Facilis adamo tonsor volup audio.,1
291,,,155,Causa uter decimus sulum.,Full Stack,Arca certus timor cruentus.,1
292,,,59,Decimus accedo centum ea desparatus allatus ubi color.,Full Stack,Summisse altus consectetur adsum desparatus.,2
293,155.0,6706701a98ac07710c36af32,287,Conatus vetus defungo aduro nemo corrupti molestiae.,Data Science,Censura claustrum uter temptatio.,1
294,,,185,Audio ustulo deserunt conforto delectatio theologus officiis tripudio undique conatus.,Data Engineering,Pecco nulla advenio viridis.,2
295,168.0,6706701a98ac07710c36af7b,256,Textilis aspicio celo denego.,Data Engineering,Cervus vere tantum delectus alioqui spargo timidus.,4
296,,,206,Eius coniecto audio titulus quidem adeptio depulso amissio.,Full Stack,Despecto toties debilito.,2
297,43.0,6706701a98ac07710c36aeff,128,Theatrum termes aeternus vulgus tersus trans theatrum vulnero circumvenio.,Full Stack,Tertius cresco debeo adfero surgo.,1
298,,,37,Ascisco ante curvo crur succedo tubineus demum.,Full Stack,Cribro desolo viscus iusto vos alveus caritas suadeo.,4
299,,,144,Molestiae eaque cunae tenax odit causa avaritia acervus supra careo.,Full Stack,Similique caute comburo succedo tui conicio.,3
300,129.0,6706701a98ac07710c36af8a,219,Harum degenero angulus vilitas.,Data Engineering,Thesaurus alius cupiditate video solvo conventus una.,4
301,197.0,670670c52ce0cd253f1fa4d1,301,Data Science ,Data Science,woow ,3
